{
  "version": "1",
  "installation_id": 987654,
  "delivery_id": "11111111-1111-4111-8111-111111111111",
  "repository": {
    "id": 1296269,
    "full_name": "octocat/hello-world"
  },
  "pull_request": {
    "number": 42,
    "head_sha": "a84d88e7554fc1fa21bcbc4efae3c0a85e3a0000"
  },
  "action": "opened",
  "actor": {
    "id": 1,
    "login": "octocat"
  },
  "review_contract": "d8cd300e795765debd5620f2e5bc68ab5fd408722774b6258266eeb55fc91e08",
  "traceparent": "00-11111111111111111111111111111111-2222222222222222-01",
  "tracestate": "vendor=value"
}
